{
  "verificationResultId": "exampleco-medium-bundle-2026-03-24-result",
  "generatedAt": "2026-03-24T01:25:00Z",
  "bundleId": "exampleco-medium-bundle-2026-03-24",
  "verifierVersion": "opencompliance-verifier/0.9.5",
  "organisation": "ExampleCo",
  "profileId": "medium_multiframework_corridor",
  "outcome": "punch_list_issued",
  "proofBundleSha256": "9dd69b41973862568e31a85a33e0b18553e0780762378b5e15011967c5481701",
  "trustSurfaceSha256": "9e801be940e33dd8590a6015834bbc36c1895e246a393a5d8e69cfaf13aa269f",
  "outcomeArtifact": {
    "path": "punch-list.json",
    "sha256": "60ebed8075e7d313746f49807645a740733b6292ec26c0eb3d1f84b2fc87e269"
  },
  "blockingIssueCount": 4
}
