{
  "verificationResultId": "exampleco-ai-governance-bundle-2026-03-24-result",
  "generatedAt": "2026-03-24T06:40:00Z",
  "bundleId": "exampleco-ai-governance-bundle-2026-03-24",
  "verifierVersion": "opencompliance-verifier/0.9.0",
  "organisation": "ExampleCo",
  "profileId": "ai_governance_corridor",
  "outcome": "certificate_issued",
  "proofBundleSha256": "568d95539015aaa7c8e38751717aad57d9d71654b3947b7e74d75cf80054f568",
  "trustSurfaceSha256": "922151c7eac4979bfe082eb9b4a0b10fa365d99000f2058c3ff0849608317d82",
  "outcomeArtifact": {
    "path": "certificate.json",
    "sha256": "d6daa89731f3a1ca1216a62ca4e9d8fb817b18dc420f77a457413be79a879763"
  },
  "blockingIssueCount": 0
}
