{
  "verificationResultId": "exampleco-medium-bundle-2026-03-24-result",
  "generatedAt": "2026-03-24T01:25:00Z",
  "bundleId": "exampleco-medium-bundle-2026-03-24",
  "verifierVersion": "opencompliance-verifier/0.9.3",
  "organisation": "ExampleCo",
  "profileId": "medium_multiframework_corridor",
  "outcome": "punch_list_issued",
  "proofBundleSha256": "661a51462fe63112ca3abc7e9ac7214eadfcf10872097fc690e37e196aa2c351",
  "trustSurfaceSha256": "9e801be940e33dd8590a6015834bbc36c1895e246a393a5d8e69cfaf13aa269f",
  "outcomeArtifact": {
    "path": "punch-list.json",
    "sha256": "3ac889b4d076d4fecaee29207bde4e5e90fe081ff5bba51696485cab7913e1ec"
  },
  "blockingIssueCount": 4
}
