{
  "verificationResultId": "exampleco-stale-bundle-2026-03-24-result",
  "generatedAt": "2026-03-24T05:20:00Z",
  "bundleId": "exampleco-stale-bundle-2026-03-24",
  "verifierVersion": "opencompliance-verifier/0.9.2",
  "organisation": "ExampleCo",
  "profileId": "stale_freshness_corridor",
  "outcome": "punch_list_issued",
  "proofBundleSha256": "17e2ab8d6a498b8c21b0aa7e341854b85196b46641486d84aa794d5917449f9d",
  "trustSurfaceSha256": "e1a7773a0182391532df63b1689eaa8ff173923b8e9d455136f5a72715423bbd",
  "outcomeArtifact": {
    "path": "punch-list.json",
    "sha256": "3de20931217c200bf77d9192cee69a3aa9c6ad810971f274f119b360d473a878"
  },
  "blockingIssueCount": 2
}
