{
  "verificationResultId": "exampleco-ai-governance-bundle-2026-03-24-result",
  "generatedAt": "2026-03-24T06:40:00Z",
  "bundleId": "exampleco-ai-governance-bundle-2026-03-24",
  "verifierVersion": "opencompliance-example/0.7.0",
  "organisation": "ExampleCo",
  "profileId": "ai_governance_corridor",
  "outcome": "certificate_issued",
  "proofBundleSha256": "1ba0c730d9dd815871676ffc6862e50106292c03229aff3801d5c92ee6887118",
  "trustSurfaceSha256": "1ccbc93fc73eb768c6b47578f0dc9d7090b9e944e7fa63f6d4adf6c07257bf08",
  "outcomeArtifact": {
    "path": "certificate.json",
    "sha256": "c7dcff6bf754bc0bd7b643d16c46b2b7defb8660aa6f467ec4fb9bfd9d48fb58"
  },
  "blockingIssueCount": 0
}
