{
  "verificationResultId": "exampleco-ai-governance-bundle-2026-03-24-result",
  "generatedAt": "2026-03-24T06:40:00Z",
  "bundleId": "exampleco-ai-governance-bundle-2026-03-24",
  "verifierVersion": "opencompliance-verifier/0.9.2",
  "organisation": "ExampleCo",
  "profileId": "ai_governance_corridor",
  "outcome": "certificate_issued",
  "proofBundleSha256": "91d404050cd95867b887a4207b7d40d4799d988866dd705cf45e4c2986d7f6b2",
  "trustSurfaceSha256": "922151c7eac4979bfe082eb9b4a0b10fa365d99000f2058c3ff0849608317d82",
  "outcomeArtifact": {
    "path": "certificate.json",
    "sha256": "741db784892440e2b083757ef09eba3ab17e545fc1b266cc5e971c49612e9ae4"
  },
  "blockingIssueCount": 0
}
