{
  "verificationResultId": "exampleco-ai-governance-bundle-2026-03-24-result",
  "generatedAt": "2026-03-24T06:40:00Z",
  "bundleId": "exampleco-ai-governance-bundle-2026-03-24",
  "verifierVersion": "opencompliance-verifier/0.8.0",
  "organisation": "ExampleCo",
  "profileId": "ai_governance_corridor",
  "outcome": "certificate_issued",
  "proofBundleSha256": "8fc0b1445750fb669b15b7dc45363b1380afb4dca24d583b2349e2c1613bcfd1",
  "trustSurfaceSha256": "922151c7eac4979bfe082eb9b4a0b10fa365d99000f2058c3ff0849608317d82",
  "outcomeArtifact": {
    "path": "certificate.json",
    "sha256": "9d594b3efac3987c53d0fca013348f2ed11f8c85f92f6af43925ce02b2d7ddae"
  },
  "blockingIssueCount": 0
}
