{
  "verificationResultId": "exampleco-medium-bundle-2026-03-24-result",
  "generatedAt": "2026-03-24T01:25:00Z",
  "bundleId": "exampleco-medium-bundle-2026-03-24",
  "verifierVersion": "opencompliance-verifier/0.8.0",
  "organisation": "ExampleCo",
  "profileId": "medium_multiframework_corridor",
  "outcome": "punch_list_issued",
  "proofBundleSha256": "49914e8dc54401efae214698ff74edaedf905f98b246f7ce30913d2c33a5140d",
  "trustSurfaceSha256": "9e801be940e33dd8590a6015834bbc36c1895e246a393a5d8e69cfaf13aa269f",
  "outcomeArtifact": {
    "path": "punch-list.json",
    "sha256": "2750e292820e8dcf1d0058a53a9a61e7d06cc3e0047b16830160d5b3469ea371"
  },
  "blockingIssueCount": 4
}
