{
  "verificationResultId": "exampleco-ai-governance-bundle-2026-03-24-result",
  "generatedAt": "2026-03-24T06:40:00Z",
  "bundleId": "exampleco-ai-governance-bundle-2026-03-24",
  "verifierVersion": "opencompliance-verifier/0.9.7",
  "organisation": "ExampleCo",
  "profileId": "ai_governance_corridor",
  "outcome": "certificate_issued",
  "proofBundleSha256": "c01ca48cb15f6c995938871185cc583e57e4a310cd3a294872704e39b7d1f734",
  "trustSurfaceSha256": "a230beb7107201a0f4ca02506ea0125e4ce5f79012995d52751529e5aa62b15a",
  "outcomeArtifact": {
    "path": "certificate.json",
    "sha256": "7cb7a16446e52e4e710e1cbd519e8fe39af644081c7741c3642a711b0e4085e7"
  },
  "blockingIssueCount": 0
}
