{
  "verificationResultId": "exampleco-medium-bundle-2026-03-24-result",
  "generatedAt": "2026-03-24T01:25:00Z",
  "bundleId": "exampleco-medium-bundle-2026-03-24",
  "verifierVersion": "opencompliance-verifier/0.9.7",
  "organisation": "ExampleCo",
  "profileId": "medium_multiframework_corridor",
  "outcome": "punch_list_issued",
  "proofBundleSha256": "f3fa85c50f4031b5dfbc77d7db07f807f4756226a7c4de17c0928b8418630ffa",
  "trustSurfaceSha256": "462ab3e4266bbe08b1db72716a5f38fb4c2a7ae80eb29667bbda36767266e4ca",
  "outcomeArtifact": {
    "path": "punch-list.json",
    "sha256": "cb94127b4cacaf2395a251c2d3495875eef2d77a63ad5119c67b70557cbbcf11"
  },
  "blockingIssueCount": 20
}
