{
  "verificationResultId": "exampleco-stale-bundle-2026-03-24-result",
  "generatedAt": "2026-03-24T05:20:00Z",
  "bundleId": "exampleco-stale-bundle-2026-03-24",
  "verifierVersion": "opencompliance-verifier/0.9.7",
  "organisation": "ExampleCo",
  "profileId": "stale_freshness_corridor",
  "outcome": "punch_list_issued",
  "proofBundleSha256": "7134a920c2abaa4c7641f3515e4148208420eaa741de35602d2e7cfc6697aa73",
  "trustSurfaceSha256": "e1a7773a0182391532df63b1689eaa8ff173923b8e9d455136f5a72715423bbd",
  "outcomeArtifact": {
    "path": "punch-list.json",
    "sha256": "1297c6150d29aec9503bc19e399344b5a411dc58a6b9bedfa8dc6d9a432b899d"
  },
  "blockingIssueCount": 2
}
