{
  "verificationResultId": "exampleco-ai-governance-bundle-2026-03-24-result",
  "generatedAt": "2026-03-24T06:40:00Z",
  "bundleId": "exampleco-ai-governance-bundle-2026-03-24",
  "verifierVersion": "opencompliance-verifier/0.9.1",
  "organisation": "ExampleCo",
  "profileId": "ai_governance_corridor",
  "outcome": "certificate_issued",
  "proofBundleSha256": "501c8d674183db213e516795139b431b1d8f63874608d5da7cbfbf31d085db6b",
  "trustSurfaceSha256": "922151c7eac4979bfe082eb9b4a0b10fa365d99000f2058c3ff0849608317d82",
  "outcomeArtifact": {
    "path": "certificate.json",
    "sha256": "c835893c8803625a80f793690cfdaedbe0d0b7258ac0050f634815a344af96ac"
  },
  "blockingIssueCount": 0
}
