{
  "verificationResultId": "exampleco-stale-bundle-2026-03-24-result",
  "generatedAt": "2026-03-24T05:20:00Z",
  "bundleId": "exampleco-stale-bundle-2026-03-24",
  "verifierVersion": "opencompliance-verifier/0.9.5",
  "organisation": "ExampleCo",
  "profileId": "stale_freshness_corridor",
  "outcome": "punch_list_issued",
  "proofBundleSha256": "7a15de6c236e4fc5a03ee3c275912267a892f6d65940983ffdd8070ae5618519",
  "trustSurfaceSha256": "e1a7773a0182391532df63b1689eaa8ff173923b8e9d455136f5a72715423bbd",
  "outcomeArtifact": {
    "path": "punch-list.json",
    "sha256": "181d19e9aece4c873ee5e3f6d65af5ae9342bd6a7e222363122c7d222a94db1d"
  },
  "blockingIssueCount": 2
}
