{
  "verificationResultId": "exampleco-minimal-bundle-2026-03-24-result",
  "generatedAt": "2026-03-24T00:05:00Z",
  "bundleId": "exampleco-minimal-bundle-2026-03-24",
  "verifierVersion": "opencompliance-verifier/0.9.3",
  "organisation": "ExampleCo",
  "profileId": "minimal_saas_corridor",
  "outcome": "punch_list_issued",
  "proofBundleSha256": "b68ea3c0e60c31988d253da227820d9e4d3a416d60a3f71900967d565ca2fde7",
  "trustSurfaceSha256": "485c6c6a5b4ee0693f663cc4c688c9bbd6d3848abb1710c2c3046b55ab72332c",
  "outcomeArtifact": {
    "path": "punch-list.json",
    "sha256": "68d05891d05c34392e04195e597c0d61face601e9aa893d7d444e04ed856795b"
  },
  "blockingIssueCount": 2
}
