{
  "verificationResultId": "exampleco-ai-governance-bundle-2026-03-24-result",
  "generatedAt": "2026-03-24T06:40:00Z",
  "bundleId": "exampleco-ai-governance-bundle-2026-03-24",
  "verifierVersion": "opencompliance-verifier/0.9.6",
  "organisation": "ExampleCo",
  "profileId": "ai_governance_corridor",
  "outcome": "certificate_issued",
  "proofBundleSha256": "7ff034b20a249e9d31bda5059ef2ba8d1c9284caf1d662e19aceb48aee05a86b",
  "trustSurfaceSha256": "a230beb7107201a0f4ca02506ea0125e4ce5f79012995d52751529e5aa62b15a",
  "outcomeArtifact": {
    "path": "certificate.json",
    "sha256": "8dc1a121f669437ca0d003f76f4a431ef81039dbf0e351eebc370471e75c260f"
  },
  "blockingIssueCount": 0
}
