{
  "verificationResultId": "exampleco-minimal-bundle-2026-03-24-result",
  "generatedAt": "2026-03-24T00:05:00Z",
  "bundleId": "exampleco-minimal-bundle-2026-03-24",
  "verifierVersion": "opencompliance-verifier/0.8.0",
  "organisation": "ExampleCo",
  "profileId": "minimal_saas_corridor",
  "outcome": "punch_list_issued",
  "proofBundleSha256": "e53cb3dff3cf5f8d7cc47b487aaef6160fd929781015ed06ff2f90d51c84e359",
  "trustSurfaceSha256": "485c6c6a5b4ee0693f663cc4c688c9bbd6d3848abb1710c2c3046b55ab72332c",
  "outcomeArtifact": {
    "path": "punch-list.json",
    "sha256": "b5e16f79be775771385a46b142d361d4714a3bc75a5401686df7e259092f36d5"
  },
  "blockingIssueCount": 2
}
