{
  "verificationResultId": "exampleco-cyber-baseline-bundle-2026-03-24-result",
  "generatedAt": "2026-03-24T06:10:00Z",
  "bundleId": "exampleco-cyber-baseline-bundle-2026-03-24",
  "verifierVersion": "opencompliance-verifier/0.9.3",
  "organisation": "ExampleCo",
  "profileId": "cyber_baseline_corridor",
  "outcome": "certificate_issued",
  "proofBundleSha256": "4c64dcdde9114066a0a33d8fb6d0b638f7137c28db4d8f5599ac4be3d93e6f88",
  "trustSurfaceSha256": "9c4a155895010fd089e14d32dd6757f50e3cef5e66392dbc9d5b89d5865eda14",
  "outcomeArtifact": {
    "path": "certificate.json",
    "sha256": "85799d3af494b61e211ecc65df27e663618dbfc0de7c551def14adb0d5f98919"
  },
  "blockingIssueCount": 0
}
