{
  "verificationResultId": "exampleco-issued-bundle-2026-03-24-result",
  "generatedAt": "2026-03-24T02:10:00Z",
  "bundleId": "exampleco-issued-bundle-2026-03-24",
  "verifierVersion": "opencompliance-verifier/0.8.0",
  "organisation": "ExampleCo",
  "profileId": "issued_narrow_corridor",
  "outcome": "certificate_issued",
  "proofBundleSha256": "0dc1057e7ff2db1bcf97039eb9c4aecc92bdcf229a4a07bfb260553995ea6d4f",
  "trustSurfaceSha256": "d23ec5a6abb39727d6f763cb1498fc764a9b81a3e1793a29f876574b2b6ff226",
  "outcomeArtifact": {
    "path": "certificate.json",
    "sha256": "1208f4028c3ac877b2b1d161c93f81e75a233030e54fd83cbb570801be7f7338"
  },
  "blockingIssueCount": 0
}
