{
  "verificationResultId": "exampleco-issued-bundle-2026-03-24-result",
  "generatedAt": "2026-03-24T02:10:00Z",
  "bundleId": "exampleco-issued-bundle-2026-03-24",
  "verifierVersion": "opencompliance-verifier/0.9.9",
  "organisation": "ExampleCo",
  "profileId": "issued_narrow_corridor",
  "outcome": "certificate_issued",
  "proofBundleSha256": "9d20d262aa495dcdd040aff40da60b9e92a1ffda27539dab3793e4f05b537241",
  "trustSurfaceSha256": "d23ec5a6abb39727d6f763cb1498fc764a9b81a3e1793a29f876574b2b6ff226",
  "outcomeArtifact": {
    "path": "certificate.json",
    "sha256": "64a4e43de9c2a8ebbbf25a8ab2d8c621ce09b5baf456e6efda107cffb0b83f33"
  },
  "blockingIssueCount": 0
}
