{
  "verificationResultId": "exampleco-cyber-baseline-bundle-2026-03-24-result",
  "generatedAt": "2026-03-24T06:10:00Z",
  "bundleId": "exampleco-cyber-baseline-bundle-2026-03-24",
  "verifierVersion": "opencompliance-verifier/0.9.7",
  "organisation": "ExampleCo",
  "profileId": "cyber_baseline_corridor",
  "outcome": "certificate_issued",
  "proofBundleSha256": "644b7e4155b2047b452f090f0def681c02f8ef1abf1628f0095a1a44baa20b87",
  "trustSurfaceSha256": "9c4a155895010fd089e14d32dd6757f50e3cef5e66392dbc9d5b89d5865eda14",
  "outcomeArtifact": {
    "path": "certificate.json",
    "sha256": "b5a5d7971a6571f51b0d7fae586b4355f413922ea6d8786ece532586304cbef7"
  },
  "blockingIssueCount": 0
}
